{
  "causal_question": "What is the value of all retained governance knowledge?",
  "condition_id": "L1",
  "confidence_method": "paired_case_replay_with_deterministic_2000_draw_bootstrap",
  "harness_invalid": false,
  "isolated_factor": "retained_governance_state",
  "observed_deltas": {
    "active_basis": 0.0,
    "active_basis_max": 0.0,
    "case_count": 0.0,
    "discovery_rounds": 0.0625,
    "frr": 0.0,
    "g1_memory_hit_rate": 0.0,
    "g1_rounds": 0.0,
    "g1_scope_leakage": 0.0,
    "g2_memory_hit_rate": -0.0625,
    "g2_rounds": 0.046875,
    "g2_scope_leakage": 0.0,
    "g3_memory_hit_rate": -0.08333333333333337,
    "g3_rounds": 0.07291666666666669,
    "g3_scope_leakage": 0.0,
    "library_size": 0.0,
    "memory_hit_rate": -0.0625,
    "phase4_case_count": 0.0,
    "phase4_frr": 0.0,
    "phase4_original_escalation": 0.0,
    "phase4_residual_escalation": 0.0,
    "phase4_rounds": 0.0,
    "phase4_uar": 0.0,
    "phase4_world_count": 0.0,
    "quarantine_or_rollback": 0.0,
    "query_count": 0.046874999999999986,
    "query_yield": 0.0,
    "redundancy": 0.0,
    "repeated_failed_paths": 0.0,
    "residual_escalation": 0.0,
    "retrieval_cost": -0.10416666666666674,
    "rounds": 0.05208333333333334,
    "scope_leakage": 0.0,
    "stale_scope_activation": 0.0,
    "synthesis_count": 1.0,
    "uar": 0.0
  },
  "outcome": "EXPECTED_DEGRADATION",
  "pass_fail_interpretation": "L0 must be no worse on protected errors and improve a preregistered learning or burden metric.",
  "preregistered_expected_direction": "burden_or_learning_worse_than_cumulative",
  "reference_id": "L0",
  "required_metrics": [
    "uar",
    "frr",
    "residual_escalation",
    "rounds",
    "cold_start",
    "closure"
  ],
  "schema_version": "1.0.0",
  "theory_revision": false,
  "unchanged_fields": [
    "locked_banks",
    "seeds",
    "later_generation_ledgers",
    "code",
    "compute_budget",
    "memory_budget",
    "metrics"
  ]
}
