{
  "causal_question": "What does the complete Version 0.4 Perception-Closure runtime achieve?",
  "condition_id": "P0",
  "confidence_method": "paired_case_replay_with_deterministic_2000_draw_bootstrap",
  "harness_invalid": false,
  "isolated_factor": "full_perception_closure_runtime",
  "observed_deltas": {
    "active_basis": 0.0,
    "active_basis_max": 0.0,
    "additive_severity_use": 0.0,
    "case_count": 0.0,
    "closure_error": 0.0,
    "false_rejection_count": 0.0,
    "frr": 0.0,
    "initial_unresolved": 0.0,
    "irrelevant_activation": 0.0,
    "local_resolution": 0.0,
    "meta_signal_hard_veto": 0.0,
    "oracle_access_count": 0.0,
    "phase4_case_count": 0.0,
    "phase4_frr": 0.0,
    "phase4_original_escalation": 0.0,
    "phase4_residual_escalation": 0.0,
    "phase4_rounds": 0.0,
    "phase4_uar": 0.0,
    "phase4_world_count": 0.0,
    "query_count": 0.0,
    "query_yield": 0.0,
    "residual_escalation": 0.0,
    "residual_escalation_count": 0.0,
    "rounds": 0.0,
    "safe_total": 0.0,
    "scope_leakage": 0.0,
    "uar": 0.0,
    "uncertified_composition_influence": 0.0,
    "uncertified_terminal_count": 0.0,
    "unsafe_acceptance_count": 0.0,
    "unsafe_total": 0.0
  },
  "outcome": "PASS",
  "pass_fail_interpretation": "Every Phase 7 gate must pass or all runtime causal claims stop.",
  "preregistered_expected_direction": "reference_pass",
  "reference_id": "P0",
  "required_metrics": [
    "uar",
    "frr",
    "residual_escalation",
    "local_resolution",
    "scope_leakage",
    "active_basis"
  ],
  "schema_version": "1.0.0",
  "theory_revision": false,
  "unchanged_fields": [
    "locked_banks",
    "seeds",
    "budgets",
    "diagnostics",
    "scopes",
    "metrics"
  ]
}
