{
  "causal_question": "Can confounded or label-leaking dependencies pass without counterfactual audit?",
  "condition_id": "I9",
  "confidence_method": "paired_case_replay_with_deterministic_2000_draw_bootstrap",
  "harness_invalid": false,
  "isolated_factor": "counterfactual_dependency_audit",
  "observed_deltas": {
    "active_eligibility": 20.0,
    "behavioral_class_count": -15.0,
    "behavioral_equivalent_count": 15.0,
    "candidate_count": 0.0,
    "certification_pressure": 20.0,
    "firewall_detected": 0.0,
    "harmful_noop_rate": 0.975,
    "missing_witness_promotions": 10.0,
    "operation_noncompliance": 8.0,
    "parameter_diversity": 0.0,
    "phase4_case_count": 0.0,
    "phase4_frr": 0.0,
    "phase4_original_escalation": 0.0,
    "phase4_residual_escalation": 0.0,
    "phase4_rounds": 0.0,
    "phase4_uar": 0.0,
    "phase4_world_count": 0.0,
    "protected_error": 0.2855034722222223,
    "publication_allowed": -1.0,
    "scope_leakage": 0.0,
    "semantic_class_count": -1.0,
    "semantic_duplicate_count": 1.0,
    "shared_active_basis": 0.0,
    "shared_active_basis_max": 0.0,
    "shared_additive_severity_use": 0.0,
    "shared_case_count": 0.0,
    "shared_closure_error": 0.0,
    "shared_false_rejection_count": 0.0,
    "shared_frr": 0.0,
    "shared_initial_unresolved": 0.0,
    "shared_irrelevant_activation": 0.0,
    "shared_local_resolution": 0.0,
    "shared_meta_signal_hard_veto": 0.0,
    "shared_oracle_access_count": 0.0,
    "shared_query_count": 0.0,
    "shared_query_yield": 0.0,
    "shared_residual_escalation": 0.0,
    "shared_residual_escalation_count": 0.0,
    "shared_rounds": 0.0,
    "shared_safe_total": 0.0,
    "shared_scope_leakage": 0.0,
    "shared_uar": 0.0,
    "shared_uncertified_composition_influence": 0.0,
    "shared_uncertified_terminal_count": 0.0,
    "shared_unsafe_acceptance_count": 0.0,
    "shared_unsafe_total": 0.0,
    "taint_count": 0.0,
    "template_count": -11.0,
    "valid_yield": 0.5,
    "witness_success": 0.0,
    "witnessed_yield": 0.25
  },
  "outcome": "EXPECTED_DEGRADATION",
  "pass_fail_interpretation": "Violations must increase on planted confounds; failure to exercise them invalidates the fixture.",
  "preregistered_expected_direction": "counterfactual_violations_increase",
  "reference_id": "I0",
  "required_metrics": [
    "nuisance_violations",
    "causal_violations",
    "false_witness_rate",
    "promotion_pressure"
  ],
  "schema_version": "1.0.0",
  "theory_revision": false,
  "unchanged_fields": [
    "locked_banks",
    "seeds",
    "scope_gates",
    "retained_gates",
    "holdout_gates",
    "adversarial_gates",
    "fitting"
  ]
}
