{
  "causal_question": "Can privileged hidden-world leakage create impossible performance?",
  "condition_id": "I7",
  "confidence_method": "paired_case_replay_with_deterministic_2000_draw_bootstrap",
  "harness_invalid": false,
  "isolated_factor": "hidden_field_exposure",
  "observed_deltas": {
    "active_eligibility": 0.0,
    "behavioral_class_count": 0.0,
    "behavioral_equivalent_count": 0.0,
    "candidate_count": 0.0,
    "certification_pressure": 0.0,
    "firewall_detected": 1.0,
    "harmful_noop_rate": 0.0,
    "missing_witness_promotions": 0.0,
    "operation_noncompliance": 0.0,
    "parameter_diversity": 0.0,
    "phase4_case_count": 0.0,
    "phase4_frr": 0.0,
    "phase4_original_escalation": 0.0,
    "phase4_residual_escalation": 0.0,
    "phase4_rounds": 0.0,
    "phase4_uar": 0.0,
    "phase4_world_count": 0.0,
    "protected_error": 0.0,
    "publication_allowed": 0.0,
    "scope_leakage": 0.0,
    "semantic_class_count": 0.0,
    "semantic_duplicate_count": 0.0,
    "shared_active_basis": 0.0,
    "shared_active_basis_max": 0.0,
    "shared_additive_severity_use": 0.0,
    "shared_case_count": 0.0,
    "shared_closure_error": 0.0,
    "shared_false_rejection_count": 0.0,
    "shared_frr": 0.0,
    "shared_initial_unresolved": 0.0,
    "shared_irrelevant_activation": 0.0,
    "shared_local_resolution": 0.0,
    "shared_meta_signal_hard_veto": 0.0,
    "shared_oracle_access_count": 0.0,
    "shared_query_count": 0.0,
    "shared_query_yield": 0.0,
    "shared_residual_escalation": 0.0,
    "shared_residual_escalation_count": 0.0,
    "shared_rounds": 0.0,
    "shared_safe_total": 0.0,
    "shared_scope_leakage": 0.0,
    "shared_uar": 0.0,
    "shared_uncertified_composition_influence": 0.0,
    "shared_uncertified_terminal_count": 0.0,
    "shared_unsafe_acceptance_count": 0.0,
    "shared_unsafe_total": 0.0,
    "taint_count": 3.0,
    "template_count": 0.0,
    "valid_yield": 0.0,
    "witness_success": 0.0,
    "witnessed_yield": 0.0
  },
  "outcome": "EXPECTED_FIREWALL_DETECTION",
  "pass_fail_interpretation": "The firewall must detect and quarantine hidden fields; any valid gain or contamination invalidates the harness.",
  "preregistered_expected_direction": "firewall_detection_no_valid_gain",
  "reference_id": "I0",
  "required_metrics": [
    "hidden_taint_count",
    "impossible_witness_count",
    "valid_performance_delta",
    "contamination_count"
  ],
  "schema_version": "1.0.0",
  "theory_revision": false,
  "unchanged_fields": [
    "locked_banks",
    "seeds",
    "candidate_runtime",
    "public_evidence",
    "metrics",
    "budgets"
  ]
}
