{
  "causal_question": "Does integrity reject the exact Phase 3 template pathology?",
  "condition_id": "I1",
  "confidence_method": "paired_case_replay_with_deterministic_2000_draw_bootstrap",
  "harness_invalid": false,
  "isolated_factor": "structure_search",
  "observed_deltas": {
    "active_eligibility": -20.0,
    "behavioral_class_count": -29.0,
    "behavioral_equivalent_count": 29.0,
    "candidate_count": 0.0,
    "certification_pressure": -20.0,
    "firewall_detected": 0.0,
    "harmful_noop_rate": 0.0,
    "missing_witness_promotions": 0.0,
    "operation_noncompliance": 0.0,
    "parameter_diversity": -0.021045454545454492,
    "phase4_case_count": 0.0,
    "phase4_frr": 0.0,
    "phase4_original_escalation": 0.0,
    "phase4_residual_escalation": 0.0,
    "phase4_rounds": 0.0,
    "phase4_uar": 0.0,
    "phase4_world_count": 0.0,
    "protected_error": 0.0039496527777777984,
    "publication_allowed": -1.0,
    "scope_leakage": -0.2421875,
    "semantic_class_count": -29.0,
    "semantic_duplicate_count": 29.0,
    "shared_active_basis": 0.0,
    "shared_active_basis_max": 0.0,
    "shared_additive_severity_use": 0.0,
    "shared_case_count": 0.0,
    "shared_closure_error": 0.0,
    "shared_false_rejection_count": 0.0,
    "shared_frr": 0.0,
    "shared_initial_unresolved": 0.0,
    "shared_irrelevant_activation": 0.0,
    "shared_local_resolution": 0.0,
    "shared_meta_signal_hard_veto": 0.0,
    "shared_oracle_access_count": 0.0,
    "shared_query_count": 0.0,
    "shared_query_yield": 0.0,
    "shared_residual_escalation": 0.0,
    "shared_residual_escalation_count": 0.0,
    "shared_rounds": 0.0,
    "shared_safe_total": 0.0,
    "shared_scope_leakage": 0.0,
    "shared_uar": 0.0,
    "shared_uncertified_composition_influence": 0.0,
    "shared_uncertified_terminal_count": 0.0,
    "shared_unsafe_acceptance_count": 0.0,
    "shared_unsafe_total": 0.0,
    "taint_count": 0.0,
    "template_count": -11.0,
    "valid_yield": -0.5,
    "witness_success": 0.0,
    "witnessed_yield": -0.5
  },
  "outcome": "EXPECTED_DEGRADATION",
  "pass_fail_interpretation": "Every fixed-template name-only candidate must be rejected before performance interpretation.",
  "preregistered_expected_direction": "rejected_before_outcome_interpretation",
  "reference_id": "I0",
  "required_metrics": [
    "template_count",
    "name_only_rejections",
    "promoted_count"
  ],
  "schema_version": "1.0.0",
  "theory_revision": false,
  "unchanged_fields": [
    "locked_banks",
    "seeds",
    "budgets",
    "candidate_count",
    "certifier",
    "metrics"
  ]
}
