{
  "causal_question": "What remains unresolved without situational closure?",
  "condition_id": "P1",
  "confidence_method": "paired_case_replay_with_deterministic_2000_draw_bootstrap",
  "harness_invalid": false,
  "isolated_factor": "resolver",
  "observed_deltas": {
    "active_basis": 0.0,
    "active_basis_max": -2.0,
    "additive_severity_use": 0.0,
    "case_count": 0.0,
    "closure_error": 0.75,
    "false_rejection_count": 0.0,
    "frr": 0.0,
    "initial_unresolved": 0.0,
    "irrelevant_activation": -64.0,
    "local_resolution": -288.0,
    "meta_signal_hard_veto": 0.0,
    "oracle_access_count": 0.0,
    "phase4_case_count": 0.0,
    "phase4_frr": 0.0,
    "phase4_original_escalation": 0.0,
    "phase4_residual_escalation": 0.16924,
    "phase4_rounds": -0.16924,
    "phase4_uar": -0.1659570350299981,
    "phase4_world_count": 0.0,
    "query_count": -0.6666666666666666,
    "query_yield": -0.6666666666666666,
    "residual_escalation": 0.75,
    "residual_escalation_count": 288.0,
    "rounds": -0.9166666666666666,
    "safe_total": 0.0,
    "scope_leakage": 0.0,
    "uar": 0.0,
    "uncertified_composition_influence": 0.0,
    "uncertified_terminal_count": 0.0,
    "unsafe_acceptance_count": 0.0,
    "unsafe_total": 0.0
  },
  "outcome": "EXPECTED_DEGRADATION",
  "pass_fail_interpretation": "P0 must improve local resolution and residual escalation without protected regression.",
  "preregistered_expected_direction": "residual_escalation_increase",
  "reference_id": "P0",
  "required_metrics": [
    "initial_unresolved",
    "local_resolution",
    "residual_escalation",
    "uar",
    "frr"
  ],
  "schema_version": "1.0.0",
  "theory_revision": false,
  "unchanged_fields": [
    "locked_banks",
    "seeds",
    "fast_loop",
    "visible_evidence",
    "terminal_policy",
    "budgets",
    "metrics"
  ]
}
