{
  "causal_question": "Can individually valid diagnostics become unsafe together?",
  "condition_id": "P9",
  "confidence_method": "paired_case_replay_with_deterministic_2000_draw_bootstrap",
  "harness_invalid": false,
  "isolated_factor": "interaction_certificates",
  "observed_deltas": {
    "active_basis": 0.0,
    "active_basis_max": 0.0,
    "additive_severity_use": 0.0,
    "case_count": 0.0,
    "closure_error": 0.08333333333333333,
    "false_rejection_count": 16.0,
    "frr": 0.08333333333333333,
    "initial_unresolved": 0.0,
    "irrelevant_activation": 0.0,
    "local_resolution": 0.0,
    "meta_signal_hard_veto": 0.0,
    "oracle_access_count": 0.0,
    "phase4_case_count": 0.0,
    "phase4_frr": 0.0,
    "phase4_original_escalation": 0.0,
    "phase4_residual_escalation": 0.0,
    "phase4_rounds": 0.0,
    "phase4_uar": 0.0,
    "phase4_world_count": 0.0,
    "query_count": 0.0,
    "query_yield": -0.08333333333333326,
    "residual_escalation": 0.0,
    "residual_escalation_count": 0.0,
    "rounds": -0.08333333333333326,
    "safe_total": 0.0,
    "scope_leakage": 0.0,
    "uar": 0.08333333333333333,
    "uncertified_composition_influence": 32.0,
    "uncertified_terminal_count": 32.0,
    "unsafe_acceptance_count": 16.0,
    "unsafe_total": 0.0
  },
  "outcome": "EXPECTED_DEGRADATION",
  "pass_fail_interpretation": "Planted unsafe combinations must activate or degrade; otherwise the fixture is inadequate.",
  "preregistered_expected_direction": "unsafe_composition_influence_increase",
  "reference_id": "P0",
  "required_metrics": [
    "uncertified_composition_influence",
    "interaction_violations",
    "uar",
    "frr",
    "conflict"
  ],
  "schema_version": "1.0.0",
  "theory_revision": false,
  "unchanged_fields": [
    "locked_banks",
    "seeds",
    "individual_certifications",
    "scopes",
    "sparse_limit",
    "metrics"
  ]
}
